{
  "schema_version": "1.0.1",
  "request_id": "cmd-101",
  "idempotency_key": "return:fn300000001:ext-101",
  "protocol": "CHECKBOX_REST",
  "operation_type": "RETURN",
  "fiscal_number": "FN300000001",
  "route_key": "POS-01",
  "backend_profile_id": "backend_checkbox_default",
  "transport_profile_id": "transport_checkbox_rest_default",
  "channel_owner": "front.cashdesk.app",
  "external_request_id": "ext-101",
  "business_ts": "2026-03-28T11:15:00Z",
  "payload": {
    "currency": "UAH",
    "cashier_id": "cashier-01",
    "goods_count": 1,
    "payments_count": 1,
    "receipt": {
      "type": "RETURN",
      "goods": [
        {
          "item_id": "item-1",
          "item_no": 1,
          "code": "PARKING",
          "good_id": null,
          "name": "Parking service",
          "uktzed": null,
          "barcode": "4820000000012",
          "excise_barcodes": [],
          "price": 5000,
          "quantity": 1000,
          "sum": 5000,
          "header": null,
          "footer": null,
          "discounts": [],
          "item_attributes": null,
          "is_return": true,
          "tax_id": null,
          "tax_id_2": null
        }
      ],
      "payments": [
        {
          "payment_id": "payment-1",
          "payment_type": "CASHLESS",
          "provider_type": null,
          "label": "CARD",
          "payment_code": null,
          "amount": 5000,
          "commission": null,
          "card_mask": null,
          "bank_name": null,
          "auth_code": null,
          "rrn": null,
          "payment_system": null,
          "owner_name": null,
          "terminal": null,
          "acquirer_and_seller": null,
          "receipt_no": null,
          "signature_required": null,
          "tapxphone_terminal": null,
          "acquiring_source": "MANUAL_FRONT",
          "acquiring_payload_json": null
        }
      ],
      "related_receipt_id": "rcpt-0001",
      "previous_receipt_id": null,
      "technical_return": null,
      "delivery": {
        "email": "buyer@example.com"
      },
      "rounding_enabled": true,
      "discounts": [],
      "totals": {
        "total_sum": 5000,
        "round_sum": 0,
        "discounts_sum": 0,
        "extra_charge_sum": 0
      }
    }
  },
  "payload_json": "{\"cashier_id\":\"cashier-01\",\"currency\":\"UAH\",\"goods_count\":1,\"payments_count\":1,\"receipt\":{\"delivery\":{\"email\":\"buyer@example.com\"},\"discounts\":[],\"goods\":[{\"barcode\":\"4820000000012\",\"code\":\"PARKING\",\"discounts\":[],\"excise_barcodes\":[],\"footer\":null,\"good_id\":null,\"header\":null,\"is_return\":true,\"item_attributes\":null,\"item_id\":\"item-1\",\"item_no\":1,\"name\":\"Parking service\",\"price\":5000,\"quantity\":1000,\"sum\":5000,\"tax_id\":null,\"tax_id_2\":null,\"uktzed\":null}],\"payments\":[{\"acquirer_and_seller\":null,\"acquiring_payload_json\":null,\"acquiring_source\":\"MANUAL_FRONT\",\"amount\":5000,\"auth_code\":null,\"bank_name\":null,\"card_mask\":null,\"commission\":null,\"label\":\"CARD\",\"owner_name\":null,\"payment_code\":null,\"payment_id\":\"payment-1\",\"payment_system\":null,\"payment_type\":\"CASHLESS\",\"provider_type\":null,\"receipt_no\":null,\"rrn\":null,\"signature_required\":null,\"tapxphone_terminal\":null,\"terminal\":null}],\"previous_receipt_id\":null,\"related_receipt_id\":\"rcpt-0001\",\"rounding_enabled\":true,\"technical_return\":null,\"totals\":{\"discounts_sum\":0,\"extra_charge_sum\":0,\"round_sum\":0,\"total_sum\":5000},\"type\":\"RETURN\"}}",
  "payload_sha256": "d2a20b2efe27b1624051c104fdefb04404155c287836e020d73af2f069ead616",
  "trace_context": {
    "source_ip": "192.168.1.50",
    "source_port": 53010,
    "session_id": "sess-101",
    "correlation_id": "corr-101"
  },
  "requires_signature": true,
  "requires_shift": true,
  "requires_fiscal_number": true,
  "requires_offline_code": false,
  "correlation_id": "corr-101"
}